{
  "schema_version": 1,
  "source": {
    "sdk": "node",
    "sdk_version": "0.1.0",
    "server_name": "orders-mcp",
    "server_version": "1.4.2",
    "instance_id": "i_7f3a2c9d1e",
    "hostname": "pod-7"
  },
  "sent_at": "2026-10-01T12:00:02.000Z",
  "dropped": 0,
  "events": [
    {
      "id": "01a0f757-6130-7bae-83de-2f6a47aafb6e",
      "ts": "2026-10-01T12:01:34.000Z",
      "type": "tool.called",
      "attrs": {
        "tool": "key",
        "duration_ms": 1,
        "is_error": false,
        "input_bytes": 1048576,
        "output_bytes": 0,
        "output_kinds": [],
        "cancelled": false,
        "args": {
          "[oversized-key]": "[truncated]",
          "userId": 42
        }
      }
    },
    {
      "id": "01a0f757-6131-7baf-93fd-2f6a47ab1a5d",
      "ts": "2026-10-01T12:01:34.001Z",
      "type": "log",
      "attrs": {
        "level": "debug",
        "message": "key",
        "fields": {
          "[oversized-key]": "[truncated]",
          "userId": 42
        }
      }
    },
    {
      "id": "01a0f757-6132-7bb0-a41c-2f6a47ab394c",
      "ts": "2026-10-01T12:01:34.002Z",
      "type": "custom",
      "attrs": {
        "name": "key",
        "props": {
          "[oversized-key]": "[truncated]",
          "userId": 42
        }
      }
    },
    {
      "id": "01a0f757-6133-7bb1-b43b-2f6a47ab583b",
      "ts": "2026-10-01T12:01:34.003Z",
      "type": "tool.called",
      "attrs": {
        "tool": "key",
        "duration_ms": 1,
        "is_error": false,
        "input_bytes": 1048576,
        "output_bytes": 0,
        "output_kinds": [],
        "cancelled": false,
        "args": {
          "omitted_key": {
            "_truncated": true,
            "_bytes": 0
          },
          "userId": 42
        }
      }
    },
    {
      "id": "01a0f757-6134-7bb2-845a-2f6a47ab772a",
      "ts": "2026-10-01T12:01:34.004Z",
      "type": "log",
      "attrs": {
        "level": "debug",
        "message": "key",
        "fields": {
          "omitted_key": {
            "_truncated": true,
            "_bytes": 0
          },
          "userId": 42
        }
      }
    },
    {
      "id": "01a0f757-6135-7bb3-9479-2f6a47ab9619",
      "ts": "2026-10-01T12:01:34.005Z",
      "type": "custom",
      "attrs": {
        "name": "key",
        "props": {
          "omitted_key": {
            "_truncated": true,
            "_bytes": 0
          },
          "userId": 42
        }
      }
    }
  ]
}
