{
  "schema_version": 1,
  "source": {
    "sdk": "node",
    "sdk_version": "0.1.0",
    "server_name": "orders-mcp",
    "server_version": "1.4.2",
    "instance_id": "i_7f3a2c9d1e",
    "hostname": "pod-7"
  },
  "sent_at": "2026-10-01T12:00:02.000Z",
  "dropped": 0,
  "events": [
    {
      "id": "01a0f755-f209-7c87-9e25-2f6a1b4da405",
      "ts": "2026-10-01T12:00:00.009Z",
      "type": "session.ended",
      "session_id": "s_01J9X0K3E2",
      "client": {
        "name": "claude-ai",
        "version": "1.2.0",
        "protocol_version": "2025-06-18"
      },
      "caller": {
        "key_id": "k_8f3a2c",
        "subject": null,
        "ip": "203.0.113.9",
        "user_agent": "claude-ai/1.2.0"
      },
      "attrs": {
        "duration_ms": 60000,
        "reason": "client"
      }
    }
  ]
}
