{
  "schema_version": 1,
  "source": {
    "sdk": "python",
    "sdk_version": "0.1.0",
    "server_name": "orders-mcp",
    "server_version": "1.4.2",
    "instance_id": "i_7f3a2c9d1e",
    "hostname": "pod-7"
  },
  "sent_at": "2026-10-01T12:00:02.000Z",
  "dropped": 0,
  "events": [
    {
      "id": "01a0f755-f20a-7c88-ae44-2f6a1b4dc2f4",
      "ts": "2026-10-01T12:00:00.010Z",
      "type": "session.started",
      "session_id": "s_01J9X0K3E2",
      "client": {
        "name": "claude-ai",
        "version": "1.2.0",
        "protocol_version": "2025-06-18"
      },
      "caller": {
        "key_id": "k_8f3a2c",
        "subject": null,
        "ip": "203.0.113.9",
        "user_agent": "claude-ai/1.2.0"
      },
      "attrs": {
        "transport": "streamable-http"
      }
    },
    {
      "id": "01a0f755-f20b-7c89-be63-2f6a1b4de1e3",
      "ts": "2026-10-01T12:00:00.011Z",
      "type": "mcp.initialize",
      "session_id": "s_01J9X0K3E2",
      "client": {
        "name": "claude-ai",
        "version": "1.2.0",
        "protocol_version": "2025-06-18"
      },
      "caller": {
        "key_id": "k_8f3a2c",
        "subject": null,
        "ip": "203.0.113.9",
        "user_agent": "claude-ai/1.2.0"
      },
      "attrs": {
        "requested_protocol_version": "2025-06-18",
        "client_capabilities": [
          "roots",
          "sampling"
        ],
        "server_capabilities": [
          "tools",
          "resources",
          "prompts",
          "logging"
        ]
      }
    },
    {
      "id": "01a0f755-f20c-7c8a-8e82-2f6a1b4e00d2",
      "ts": "2026-10-01T12:00:00.012Z",
      "type": "mcp.request",
      "session_id": "s_01J9X0K3E2",
      "client": {
        "name": "claude-ai",
        "version": "1.2.0",
        "protocol_version": "2025-06-18"
      },
      "caller": {
        "key_id": "k_8f3a2c",
        "subject": null,
        "ip": "203.0.113.9",
        "user_agent": "claude-ai/1.2.0"
      },
      "attrs": {
        "method": "tools/list",
        "duration_ms": 3,
        "is_error": false
      }
    },
    {
      "id": "01a0f755-f20d-7c8b-9ea1-2f6a1b4e1fc1",
      "ts": "2026-10-01T12:00:00.013Z",
      "type": "tool.called",
      "session_id": "s_01J9X0K3E2",
      "client": {
        "name": "claude-ai",
        "version": "1.2.0",
        "protocol_version": "2025-06-18"
      },
      "caller": {
        "key_id": "k_8f3a2c",
        "subject": null,
        "ip": "203.0.113.9",
        "user_agent": "claude-ai/1.2.0"
      },
      "attrs": {
        "tool": "search_orders",
        "duration_ms": 142,
        "is_error": false,
        "input_bytes": 38,
        "output_bytes": 1024,
        "output_kinds": [
          "text"
        ],
        "cancelled": false,
        "args": {
          "query": "shoes",
          "api_key": "[redacted]"
        }
      }
    },
    {
      "id": "01a0f755-f20e-7c8c-aec0-2f6a1b4e3eb0",
      "ts": "2026-10-01T12:00:00.014Z",
      "type": "resource.read",
      "session_id": "s_01J9X0K3E2",
      "client": {
        "name": "claude-ai",
        "version": "1.2.0",
        "protocol_version": "2025-06-18"
      },
      "caller": {
        "key_id": "k_8f3a2c",
        "subject": null,
        "ip": "203.0.113.9",
        "user_agent": "claude-ai/1.2.0"
      },
      "attrs": {
        "uri": "orders://recent",
        "duration_ms": 12,
        "is_error": false,
        "output_bytes": 2048
      }
    },
    {
      "id": "01a0f755-f20f-7c8d-bedf-2f6a1b4e5d9f",
      "ts": "2026-10-01T12:00:00.015Z",
      "type": "prompt.get",
      "session_id": "s_01J9X0K3E2",
      "client": {
        "name": "claude-ai",
        "version": "1.2.0",
        "protocol_version": "2025-06-18"
      },
      "caller": {
        "key_id": "k_8f3a2c",
        "subject": null,
        "ip": "203.0.113.9",
        "user_agent": "claude-ai/1.2.0"
      },
      "attrs": {
        "prompt": "summarise_order",
        "duration_ms": 1,
        "is_error": false,
        "output_bytes": 512
      }
    },
    {
      "id": "01a0f755-f210-7c8e-8efe-2f6a1b4e7c8e",
      "ts": "2026-10-01T12:00:00.016Z",
      "type": "log",
      "session_id": "s_01J9X0K3E2",
      "client": {
        "name": "claude-ai",
        "version": "1.2.0",
        "protocol_version": "2025-06-18"
      },
      "caller": {
        "key_id": "k_8f3a2c",
        "subject": null,
        "ip": "203.0.113.9",
        "user_agent": "claude-ai/1.2.0"
      },
      "attrs": {
        "level": "info",
        "message": "warm cache",
        "fields": {
          "entries": 3
        },
        "tool": "search_orders"
      }
    },
    {
      "id": "01a0f755-f211-7c8f-9f1d-2f6a1b4e9b7d",
      "ts": "2026-10-01T12:00:00.017Z",
      "type": "error",
      "session_id": "s_01J9X0K3E2",
      "client": {
        "name": "claude-ai",
        "version": "1.2.0",
        "protocol_version": "2025-06-18"
      },
      "caller": {
        "key_id": "k_8f3a2c",
        "subject": null,
        "ip": "203.0.113.9",
        "user_agent": "claude-ai/1.2.0"
      },
      "attrs": {
        "message": "connection reset",
        "stack": "Error: connection reset\n    at Socket.<anonymous> (net.js:1)",
        "where": "transport"
      }
    },
    {
      "id": "01a0f755-f212-7c90-af3c-2f6a1b4eba6c",
      "ts": "2026-10-01T12:00:00.018Z",
      "type": "custom",
      "session_id": "s_01J9X0K3E2",
      "client": {
        "name": "claude-ai",
        "version": "1.2.0",
        "protocol_version": "2025-06-18"
      },
      "caller": {
        "key_id": "k_8f3a2c",
        "subject": null,
        "ip": "203.0.113.9",
        "user_agent": "claude-ai/1.2.0"
      },
      "attrs": {
        "name": "checkout_started",
        "props": {
          "total": 12.5,
          "currency": "EUR"
        }
      }
    },
    {
      "id": "01a0f755-f213-7c91-bf5b-2f6a1b4ed95b",
      "ts": "2026-10-01T12:00:00.019Z",
      "type": "session.ended",
      "session_id": "s_01J9X0K3E2",
      "client": {
        "name": "claude-ai",
        "version": "1.2.0",
        "protocol_version": "2025-06-18"
      },
      "caller": {
        "key_id": "k_8f3a2c",
        "subject": null,
        "ip": "203.0.113.9",
        "user_agent": "claude-ai/1.2.0"
      },
      "attrs": {
        "duration_ms": 60000,
        "reason": "client"
      }
    }
  ]
}
