{
  "schema_version": 1,
  "source": {
    "sdk": "node",
    "sdk_version": "0.1.0",
    "server_name": "orders-mcp",
    "server_version": "1.4.2",
    "instance_id": "i_7f3a2c9d1e",
    "hostname": "pod-7"
  },
  "sent_at": "2026-10-01T12:00:02.000Z",
  "dropped": 0,
  "events": [
    {
      "id": "01a0f757-6540-7fbe-81ce-2f6a4828a65e",
      "ts": "2026-10-01T12:01:35.040Z",
      "type": "elicitation.requested",
      "session_id": "s_01J9X0K3E2",
      "client": {
        "name": "claude-ai",
        "version": "1.2.0",
        "protocol_version": "2025-06-18"
      },
      "caller": {
        "key_id": "k_8f3a2c",
        "subject": null,
        "ip": "203.0.113.9",
        "user_agent": "claude-ai/1.2.0"
      },
      "attrs": {
        "mode": "form",
        "action": "accept",
        "duration_ms": 4200
      }
    },
    {
      "id": "01a0f757-6541-7fbf-91ed-2f6a4828c54d",
      "ts": "2026-10-01T12:01:35.041Z",
      "type": "elicitation.requested",
      "session_id": "s_01J9X0K3E2",
      "client": {
        "name": "claude-ai",
        "version": "1.2.0",
        "protocol_version": "2025-06-18"
      },
      "caller": {
        "key_id": "k_8f3a2c",
        "subject": null,
        "ip": "203.0.113.9",
        "user_agent": "claude-ai/1.2.0"
      },
      "attrs": {
        "mode": "url",
        "action": "decline",
        "duration_ms": 900
      }
    },
    {
      "id": "01a0f757-6542-7fc0-a20c-2f6a4828e43c",
      "ts": "2026-10-01T12:01:35.042Z",
      "type": "elicitation.requested",
      "session_id": "s_01J9X0K3E2",
      "client": {
        "name": "claude-ai",
        "version": "1.2.0",
        "protocol_version": "2025-06-18"
      },
      "caller": {
        "key_id": "k_8f3a2c",
        "subject": null,
        "ip": "203.0.113.9",
        "user_agent": "claude-ai/1.2.0"
      },
      "attrs": {
        "mode": "form",
        "action": "cancel",
        "duration_ms": 30000
      }
    },
    {
      "id": "01a0f757-6543-7fc1-b22b-2f6a4829032b",
      "ts": "2026-10-01T12:01:35.043Z",
      "type": "elicitation.requested",
      "session_id": "s_01J9X0K3E2",
      "client": {
        "name": "claude-ai",
        "version": "1.2.0",
        "protocol_version": "2025-06-18"
      },
      "caller": {
        "key_id": "k_8f3a2c",
        "subject": null,
        "ip": "203.0.113.9",
        "user_agent": "claude-ai/1.2.0"
      },
      "attrs": {
        "mode": "form",
        "action": "error",
        "duration_ms": 5
      }
    },
    {
      "id": "01a0f757-6544-7fc2-824a-2f6a4829221a",
      "ts": "2026-10-01T12:01:35.044Z",
      "type": "elicitation.requested",
      "session_id": "s_01J9X0K3E2",
      "client": {
        "name": "claude-ai",
        "version": "1.2.0",
        "protocol_version": "2025-06-18"
      },
      "caller": {
        "key_id": "k_8f3a2c",
        "subject": null,
        "ip": "203.0.113.9",
        "user_agent": "claude-ai/1.2.0"
      },
      "attrs": {}
    }
  ]
}
