{
  "schema_version": 1,
  "source": {
    "sdk": "node",
    "sdk_version": "0.1.0",
    "server_name": "orders-mcp",
    "server_version": "1.4.2",
    "instance_id": "i_7f3a2c9d1e",
    "hostname": "pod-7"
  },
  "sent_at": "2026-10-01T12:00:02.000Z",
  "dropped": 7,
  "events": [
    {
      "id": "01A0F755-F26E-7CEC-AA60-2F6A1B59D850",
      "ts": "2026-10-01T14:00:00.123+02:00",
      "type": "mcp.request",
      "client": {
        "name": "inspector"
      },
      "caller": {
        "ip": null,
        "user_agent": "curl/8"
      },
      "attrs": {
        "method": "ping",
        "duration_ms": 1,
        "is_error": false,
        "future_key": {
          "nested": true
        },
        "another": [
          1,
          2,
          3
        ]
      }
    },
    {
      "id": "01a0f755-f26f-7ced-ba7f-2f6a1b59f73f",
      "ts": "2026-10-01T12:00:00.111Z",
      "type": "tool.called",
      "caller": {
        "key_id": "k-with_dash",
        "subject": "client_42"
      },
      "attrs": {
        "tool": "render",
        "duration_ms": 9,
        "is_error": false,
        "input_bytes": 2,
        "output_bytes": 512,
        "output_kinds": [
          "text",
          "image",
          "audio",
          "resource",
          "ui"
        ],
        "cancelled": false,
        "sdk_specific": "preserved"
      }
    }
  ]
}
