{"schema_version":1,"source":{"sdk":"node","sdk_version":"0.1.0","server_name":"orders-mcp","server_version":"1.4.2","instance_id":"i_7f3a2c9d1e","hostname":"pod-7"},"sent_at":"2026-10-01T12:00:02.000Z","dropped":0,"events":[{"id":"01a0f757-5582-7000-a9cc-2f6a4641affc","ts":"2026-10-01T12:01:31.010Z","type":"tool.called","attrs":{"tool":"deep","duration_ms":1,"is_error":false,"input_bytes":0,"output_bytes":0,"output_kinds":[],"cancelled":false,"args":{"a":[[[[[[[[[[[[[[[[[[[[[[[[[[[[[[[[[[[[[[[[[[[[[[[[[[[[[[[[[[[[[[[[[[[[[[[[[[[[[[[[[[[[[[[[[[[[[[[[[[[[[[[[[[[[[[[[[[[[[[[[[[[[[]]]]]]]]]]]]]]]]]]]]]]]]]]]]]]]]]]]]]]]]]]]]]]]]]]]]]]]]]]]]]]]]]]]]]]]]]]]]]]]]]]]]]]]]]]]]]]]]]]]]]]]]]]]]]]]]]]]]]]]]]]]]]}}},{"id":"01a0f757-5583-7001-b9eb-2f6a4641ceeb","ts":"2026-10-01T12:01:31.011Z","type":"log","attrs":{"level":"debug","message":"deep","fields":{"a":[[[[[[[[[[[[[[[[[[[[[[[[[[[[[[[[[[[[[[[[[[[[[[[[[[[[[[[[[[[[[[[[[[[[[[[[[[[[[[[[[[[[[[[[[[[[[[[[[[[[[[[[[[[[[[[[[[[[[[[[[[[[[]]]]]]]]]]]]]]]]]]]]]]]]]]]]]]]]]]]]]]]]]]]]]]]]]]]]]]]]]]]]]]]]]]]]]]]]]]]]]]]]]]]]]]]]]]]]]]]]]]]]]]]]]]]]]]]]]]]]]]]]]]]]]}}},{"id":"01a0f757-5584-7002-8a0a-2f6a4641edda","ts":"2026-10-01T12:01:31.012Z","type":"custom","attrs":{"name":"deep","props":{"a":[[[[[[[[[[[[[[[[[[[[[[[[[[[[[[[[[[[[[[[[[[[[[[[[[[[[[[[[[[[[[[[[[[[[[[[[[[[[[[[[[[[[[[[[[[[[[[[[[[[[[[[[[[[[[[[[[[[[[[[[[[[[[]]]]]]]]]]]]]]]]]]]]]]]]]]]]]]]]]]]]]]]]]]]]]]]]]]]]]]]]]]]]]]]]]]]]]]]]]]]]]]]]]]]]]]]]]]]]]]]]]]]]]]]]]]]]]]]]]]]]]]]]]]]]]}}}]}