{
  "schema_version": 1,
  "source": {
    "sdk": "node",
    "sdk_version": "0.1.0",
    "server_name": "orders-mcp",
    "server_version": "1.4.2",
    "instance_id": "i_7f3a2c9d1e",
    "hostname": "pod-7"
  },
  "sent_at": "2026-10-01T12:00:02.000Z",
  "dropped": 0,
  "events": [
    {
      "id": "01a0f757-6536-7fb4-a098-2f6a48277108",
      "ts": "2026-10-01T12:01:35.030Z",
      "type": "sampling.requested",
      "session_id": "s_01J9X0K3E2",
      "client": {
        "name": "claude-ai",
        "version": "1.2.0",
        "protocol_version": "2025-06-18"
      },
      "caller": {
        "key_id": "k_8f3a2c",
        "subject": null,
        "ip": "203.0.113.9",
        "user_agent": "claude-ai/1.2.0"
      },
      "attrs": {
        "model": "claude-sonnet-4-5",
        "max_tokens": 1024,
        "stop_reason": "end_turn",
        "duration_ms": 820,
        "is_error": false,
        "rejected": false
      }
    },
    {
      "id": "01a0f757-6537-7fb5-b0b7-2f6a48278ff7",
      "ts": "2026-10-01T12:01:35.031Z",
      "type": "sampling.requested",
      "session_id": "s_01J9X0K3E2",
      "client": {
        "name": "claude-ai",
        "version": "1.2.0",
        "protocol_version": "2025-06-18"
      },
      "caller": {
        "key_id": "k_8f3a2c",
        "subject": null,
        "ip": "203.0.113.9",
        "user_agent": "claude-ai/1.2.0"
      },
      "attrs": {
        "max_tokens": 256,
        "duration_ms": 40,
        "is_error": false,
        "rejected": true
      }
    },
    {
      "id": "01a0f757-6538-7fb6-80d6-2f6a4827aee6",
      "ts": "2026-10-01T12:01:35.032Z",
      "type": "sampling.requested",
      "session_id": "s_01J9X0K3E2",
      "client": {
        "name": "claude-ai",
        "version": "1.2.0",
        "protocol_version": "2025-06-18"
      },
      "caller": {
        "key_id": "k_8f3a2c",
        "subject": null,
        "ip": "203.0.113.9",
        "user_agent": "claude-ai/1.2.0"
      },
      "attrs": {
        "duration_ms": 12,
        "is_error": true
      }
    },
    {
      "id": "01a0f757-6539-7fb7-90f5-2f6a4827cdd5",
      "ts": "2026-10-01T12:01:35.033Z",
      "type": "sampling.requested",
      "session_id": "s_01J9X0K3E2",
      "client": {
        "name": "claude-ai",
        "version": "1.2.0",
        "protocol_version": "2025-06-18"
      },
      "caller": {
        "key_id": "k_8f3a2c",
        "subject": null,
        "ip": "203.0.113.9",
        "user_agent": "claude-ai/1.2.0"
      },
      "attrs": {}
    }
  ]
}
