{
  "schema_version": 1,
  "source": {
    "sdk": "node",
    "sdk_version": "0.1.0",
    "server_name": "orders-mcp",
    "server_version": "1.4.2",
    "instance_id": "i_7f3a2c9d1e",
    "hostname": "pod-7"
  },
  "sent_at": "2026-10-01T12:00:02.000Z",
  "dropped": 0,
  "events": [
    {
      "id": "01a0f757-652c-7faa-8f62-2f6a48263bb2",
      "ts": "2026-10-01T12:01:35.020Z",
      "type": "tools.listed",
      "session_id": "s_01J9X0K3E2",
      "client": {
        "name": "claude-ai",
        "version": "1.2.0",
        "protocol_version": "2025-06-18"
      },
      "caller": {
        "key_id": "k_8f3a2c",
        "subject": null,
        "ip": "203.0.113.9",
        "user_agent": "claude-ai/1.2.0"
      },
      "attrs": {
        "count": 1200,
        "tools": [
          {
            "name": "search_orders",
            "annotations": [
              "readOnly",
              "idempotent"
            ],
            "schema_hash": "a100000000000000000000000000000000000000000000000000000000000000"
          },
          {
            "name": "book_flight",
            "annotations": [
              "destructive",
              "openWorld"
            ],
            "schema_hash": "b200000000000000000000000000000000000000000000000000000000000000"
          }
        ],
        "truncated": true,
        "catalog_hash": "9f2c000000000000000000000000000000000000000000000000000000000000",
        "duration_ms": 7,
        "is_error": false,
        "source": "list"
      }
    },
    {
      "id": "01a0f757-652d-7fab-9f81-2f6a48265aa1",
      "ts": "2026-10-01T12:01:35.021Z",
      "type": "tools.listed",
      "session_id": "s_01J9X0K3E2",
      "client": {
        "name": "claude-ai",
        "version": "1.2.0",
        "protocol_version": "2025-06-18"
      },
      "caller": {
        "key_id": "k_8f3a2c",
        "subject": null,
        "ip": "203.0.113.9",
        "user_agent": "claude-ai/1.2.0"
      },
      "attrs": {
        "count": 3,
        "tools": [
          {
            "name": "search_orders"
          },
          {
            "name": "book_flight"
          },
          {
            "name": "ping_tool"
          }
        ],
        "truncated": true,
        "catalog_hash": "9f2c000000000000000000000000000000000000000000000000000000000000",
        "source": "list_changed"
      }
    },
    {
      "id": "01a0f757-652e-7fac-afa0-2f6a48267990",
      "ts": "2026-10-01T12:01:35.022Z",
      "type": "tools.listed",
      "session_id": "s_01J9X0K3E2",
      "client": {
        "name": "claude-ai",
        "version": "1.2.0",
        "protocol_version": "2025-06-18"
      },
      "caller": {
        "key_id": "k_8f3a2c",
        "subject": null,
        "ip": "203.0.113.9",
        "user_agent": "claude-ai/1.2.0"
      },
      "attrs": {
        "count": 900,
        "tools": [],
        "truncated": true,
        "catalog_hash": "9f2c000000000000000000000000000000000000000000000000000000000000",
        "source": "list"
      }
    }
  ]
}
