{"schema_version":1,"source":{"sdk":"node","sdk_version":"0.1.0","server_name":"orders-mcp","server_version":"1.4.2","instance_id":"i_7f3a2c9d1e","hostname":"pod-7"},"sent_at":"2026-10-01T12:00:02.000Z","dropped":0,"events":[{"id":"01a0f757-6522-7fa0-ae2c-2f6a4825065c","ts":"2026-10-01T12:01:35.010Z","type":"tools.listed","session_id":"s_01J9X0K3E2","client":{"name":"claude-ai","version":"1.2.0","protocol_version":"2025-06-18"},"caller":{"key_id":"k_8f3a2c","subject":null,"ip":"203.0.113.9","user_agent":"claude-ai/1.2.0"},"attrs":{"count":500,"tools":[{"name":"t000"},{"name":"t001"},{"name":"t002"},{"name":"t003"},{"name":"t004"},{"name":"t005"},{"name":"t006"},{"name":"t007"},{"name":"t008"},{"name":"t009"},{"name":"t010"},{"name":"t011"},{"name":"t012"},{"name":"t013"},{"name":"t014"},{"name":"t015"},{"name":"t016"},{"name":"t017"},{"name":"t018"},{"name":"t019"},{"name":"t020"},{"name":"t021"},{"name":"t022"},{"name":"t023"},{"name":"t024"},{"name":"t025"},{"name":"t026"},{"name":"t027"},{"name":"t028"},{"name":"t029"},{"name":"t030"},{"name":"t031"},{"name":"t032"},{"name":"t033"},{"name":"t034"},{"name":"t035"},{"name":"t036"},{"name":"t037"},{"name":"t038"},{"name":"t039"},{"name":"t040"},{"name":"t041"},{"name":"t042"},{"name":"t043"},{"name":"t044"},{"name":"t045"},{"name":"t046"},{"name":"t047"},{"name":"t048"},{"name":"t049"},{"name":"t050"},{"name":"t051"},{"name":"t052"},{"name":"t053"},{"name":"t054"},{"name":"t055"},{"name":"t056"},{"name":"t057"},{"name":"t058"},{"name":"t059"},{"name":"t060"},{"name":"t061"},{"name":"t062"},{"name":"t063"},{"name":"t064"},{"name":"t065"},{"name":"t066"},{"name":"t067"},{"name":"t068"},{"name":"t069"},{"name":"t070"},{"name":"t071"},{"name":"t072"},{"name":"t073"},{"name":"t074"},{"name":"t075"},{"name":"t076"},{"name":"t077"},{"name":"t078"},{"name":"t079"},{"name":"t080"},{"name":"t081"},{"name":"t082"},{"name":"t083"},{"name":"t084"},{"name":"t085"},{"name":"t086"},{"name":"t087"},{"name":"t088"},{"name":"t089"},{"name":"t090"},{"name":"t091"},{"name":"t092"},{"name":"t093"},{"name":"t094"},{"name":"t095"},{"name":"t096"},{"name":"t097"},{"name":"t098"},{"name":"t099"},{"name":"t100"},{"name":"t101"},{"name":"t102"},{"name":"t103"},{"name":"t104"},{"name":"t105"},{"name":"t106"},{"name":"t107"},{"name":"t108"},{"name":"t109"},{"name":"t110"},{"name":"t111"},{"name":"t112"},{"name":"t113"},{"name":"t114"},{"name":"t115"},{"name":"t116"},{"name":"t117"},{"name":"t118"},{"name":"t119"},{"name":"t120"},{"name":"t121"},{"name":"t122"},{"name":"t123"},{"name":"t124"},{"name":"t125"},{"name":"t126"},{"name":"t127"},{"name":"t128"},{"name":"t129"},{"name":"t130"},{"name":"t131"},{"name":"t132"},{"name":"t133"},{"name":"t134"},{"name":"t135"},{"name":"t136"},{"name":"t137"},{"name":"t138"},{"name":"t139"},{"name":"t140"},{"name":"t141"},{"name":"t142"},{"name":"t143"},{"name":"t144"},{"name":"t145"},{"name":"t146"},{"name":"t147"},{"name":"t148"},{"name":"t149"},{"name":"t150"},{"name":"t151"},{"name":"t152"},{"name":"t153"},{"name":"t154"},{"name":"t155"},{"name":"t156"},{"name":"t157"},{"name":"t158"},{"name":"t159"},{"name":"t160"},{"name":"t161"},{"name":"t162"},{"name":"t163"},{"name":"t164"},{"name":"t165"},{"name":"t166"},{"name":"t167"},{"name":"t168"},{"name":"t169"},{"name":"t170"},{"name":"t171"},{"name":"t172"},{"name":"t173"},{"name":"t174"},{"name":"t175"},{"name":"t176"},{"name":"t177"},{"name":"t178"},{"name":"t179"},{"name":"t180"},{"name":"t181"},{"name":"t182"},{"name":"t183"},{"name":"t184"},{"name":"t185"},{"name":"t186"},{"name":"t187"},{"name":"t188"},{"name":"t189"},{"name":"t190"},{"name":"t191"},{"name":"t192"},{"name":"t193"},{"name":"t194"},{"name":"t195"},{"name":"t196"},{"name":"t197"},{"name":"t198"},{"name":"t199"},{"name":"t200"},{"name":"t201"},{"name":"t202"},{"name":"t203"},{"name":"t204"},{"name":"t205"},{"name":"t206"},{"name":"t207"},{"name":"t208"},{"name":"t209"},{"name":"t210"},{"name":"t211"},{"name":"t212"},{"name":"t213"},{"name":"t214"},{"name":"t215"},{"name":"t216"},{"name":"t217"},{"name":"t218"},{"name":"t219"},{"name":"t220"},{"name":"t221"},{"name":"t222"},{"name":"t223"},{"name":"t224"},{"name":"t225"},{"name":"t226"},{"name":"t227"},{"name":"t228"},{"name":"t229"},{"name":"t230"},{"name":"t231"},{"name":"t232"},{"name":"t233"},{"name":"t234"},{"name":"t235"},{"name":"t236"},{"name":"t237"},{"name":"t238"},{"name":"t239"},{"name":"t240"},{"name":"t241"},{"name":"t242"},{"name":"t243"},{"name":"t244"},{"name":"t245"},{"name":"t246"},{"name":"t247"},{"name":"t248"},{"name":"t249"},{"name":"t250"},{"name":"t251"},{"name":"t252"},{"name":"t253"},{"name":"t254"},{"name":"t255"},{"name":"t256"},{"name":"t257"},{"name":"t258"},{"name":"t259"},{"name":"t260"},{"name":"t261"},{"name":"t262"},{"name":"t263"},{"name":"t264"},{"name":"t265"},{"name":"t266"},{"name":"t267"},{"name":"t268"},{"name":"t269"},{"name":"t270"},{"name":"t271"},{"name":"t272"},{"name":"t273"},{"name":"t274"},{"name":"t275"},{"name":"t276"},{"name":"t277"},{"name":"t278"},{"name":"t279"},{"name":"t280"},{"name":"t281"},{"name":"t282"},{"name":"t283"},{"name":"t284"},{"name":"t285"},{"name":"t286"},{"name":"t287"},{"name":"t288"},{"name":"t289"},{"name":"t290"},{"name":"t291"},{"name":"t292"},{"name":"t293"},{"name":"t294"},{"name":"t295"},{"name":"t296"},{"name":"t297"},{"name":"t298"},{"name":"t299"},{"name":"t300"},{"name":"t301"},{"name":"t302"},{"name":"t303"},{"name":"t304"},{"name":"t305"},{"name":"t306"},{"name":"t307"},{"name":"t308"},{"name":"t309"},{"name":"t310"},{"name":"t311"},{"name":"t312"},{"name":"t313"},{"name":"t314"},{"name":"t315"},{"name":"t316"},{"name":"t317"},{"name":"t318"},{"name":"t319"},{"name":"t320"},{"name":"t321"},{"name":"t322"},{"name":"t323"},{"name":"t324"},{"name":"t325"},{"name":"t326"},{"name":"t327"},{"name":"t328"},{"name":"t329"},{"name":"t330"},{"name":"t331"},{"name":"t332"},{"name":"t333"},{"name":"t334"},{"name":"t335"},{"name":"t336"},{"name":"t337"},{"name":"t338"},{"name":"t339"},{"name":"t340"},{"name":"t341"},{"name":"t342"},{"name":"t343"},{"name":"t344"},{"name":"t345"},{"name":"t346"},{"name":"t347"},{"name":"t348"},{"name":"t349"},{"name":"t350"},{"name":"t351"},{"name":"t352"},{"name":"t353"},{"name":"t354"},{"name":"t355"},{"name":"t356"},{"name":"t357"},{"name":"t358"},{"name":"t359"},{"name":"t360"},{"name":"t361"},{"name":"t362"},{"name":"t363"},{"name":"t364"},{"name":"t365"},{"name":"t366"},{"name":"t367"},{"name":"t368"},{"name":"t369"},{"name":"t370"},{"name":"t371"},{"name":"t372"},{"name":"t373"},{"name":"t374"},{"name":"t375"},{"name":"t376"},{"name":"t377"},{"name":"t378"},{"name":"t379"},{"name":"t380"},{"name":"t381"},{"name":"t382"},{"name":"t383"},{"name":"t384"},{"name":"t385"},{"name":"t386"},{"name":"t387"},{"name":"t388"},{"name":"t389"},{"name":"t390"},{"name":"t391"},{"name":"t392"},{"name":"t393"},{"name":"t394"},{"name":"t395"},{"name":"t396"},{"name":"t397"},{"name":"t398"},{"name":"t399"},{"name":"t400"},{"name":"t401"},{"name":"t402"},{"name":"t403"},{"name":"t404"},{"name":"t405"},{"name":"t406"},{"name":"t407"},{"name":"t408"},{"name":"t409"},{"name":"t410"},{"name":"t411"},{"name":"t412"},{"name":"t413"},{"name":"t414"},{"name":"t415"},{"name":"t416"},{"name":"t417"},{"name":"t418"},{"name":"t419"},{"name":"t420"},{"name":"t421"},{"name":"t422"},{"name":"t423"},{"name":"t424"},{"name":"t425"},{"name":"t426"},{"name":"t427"},{"name":"t428"},{"name":"t429"},{"name":"t430"},{"name":"t431"},{"name":"t432"},{"name":"t433"},{"name":"t434"},{"name":"t435"},{"name":"t436"},{"name":"t437"},{"name":"t438"},{"name":"t439"},{"name":"t440"},{"name":"t441"},{"name":"t442"},{"name":"t443"},{"name":"t444"},{"name":"t445"},{"name":"t446"},{"name":"t447"},{"name":"t448"},{"name":"t449"},{"name":"t450"},{"name":"t451"},{"name":"t452"},{"name":"t453"},{"name":"t454"},{"name":"t455"},{"name":"t456"},{"name":"t457"},{"name":"t458"},{"name":"t459"},{"name":"t460"},{"name":"t461"},{"name":"t462"},{"name":"t463"},{"name":"t464"},{"name":"t465"},{"name":"t466"},{"name":"t467"},{"name":"t468"},{"name":"t469"},{"name":"t470"},{"name":"t471"},{"name":"t472"},{"name":"t473"},{"name":"t474"},{"name":"t475"},{"name":"t476"},{"name":"t477"},{"name":"t478"},{"name":"t479"},{"name":"t480"},{"name":"t481"},{"name":"t482"},{"name":"t483"},{"name":"t484"},{"name":"t485"},{"name":"t486"},{"name":"t487"},{"name":"t488"},{"name":"t489"},{"name":"t490"},{"name":"t491"},{"name":"t492"},{"name":"t493"},{"name":"t494"},{"name":"t495"},{"name":"t496"},{"name":"t497"},{"name":"t498"},{"name":"t499"}],"catalog_hash":"cccccccccccccccccccccccccccccccccccccccccccccccccccccccccccccccc","source":"list"}},{"id":"01a0f757-6523-7fa1-be4b-2f6a4825254b","ts":"2026-10-01T12:01:35.011Z","type":"tools.listed","session_id":"s_01J9X0K3E2","client":{"name":"claude-ai","version":"1.2.0","protocol_version":"2025-06-18"},"caller":{"key_id":"k_8f3a2c","subject":null,"ip":"203.0.113.9","user_agent":"claude-ai/1.2.0"},"attrs":{"count":1,"tools":[{"name":"nnnnnnnnnnnnnnnnnnnnnnnnnnnnnnnnnnnnnnnnnnnnnnnnnnnnnnnnnnnnnnnnnnnnnnnnnnnnnnnnnnnnnnnnnnnnnnnnnnnnnnnnnnnnnnnnnnnnnnnnnnnnnnnnnnnnnnnnnnnnnnnnnnnnnnnnnnnnnnnnnnnnnnnnnnnnnnnnnnnnnnnnnnnnnnnnnnnnnnnnnnnnnnnnnnnnnnnnnnnnnnnnnnnnnnnnnnnnnnnnnnnnnnnnnnnnnnnn","annotations":["a0nnnnnnnnnnnnnnnnnnnnnnnnnnnnnn","a1nnnnnnnnnnnnnnnnnnnnnnnnnnnnnn","a2nnnnnnnnnnnnnnnnnnnnnnnnnnnnnn","a3nnnnnnnnnnnnnnnnnnnnnnnnnnnnnn","a4nnnnnnnnnnnnnnnnnnnnnnnnnnnnnn","a5nnnnnnnnnnnnnnnnnnnnnnnnnnnnnn","a6nnnnnnnnnnnnnnnnnnnnnnnnnnnnnn","a7nnnnnnnnnnnnnnnnnnnnnnnnnnnnnn"],"schema_hash":"hhhhhhhhhhhhhhhhhhhhhhhhhhhhhhhhhhhhhhhhhhhhhhhhhhhhhhhhhhhhhhhh"}],"catalog_hash":"cccccccccccccccccccccccccccccccccccccccccccccccccccccccccccccccc","source":"list"}}]}