{
  "schema_version": 1,
  "source": {
    "sdk": "node",
    "sdk_version": "0.1.0",
    "server_name": "orders-mcp",
    "server_version": "1.4.2",
    "instance_id": "i_7f3a2c9d1e",
    "hostname": "pod-7"
  },
  "sent_at": "2026-10-01T12:00:02.000Z",
  "dropped": 0,
  "events": [
    {
      "id": "01a0f756-dc60-76de-8eae-2f6a379e9d3e",
      "ts": "2026-10-01T12:01:00.000Z",
      "type": "tool.called",
      "session_id": "s_01J9X0K3E2",
      "client": {
        "name": "claude-ai",
        "version": "1.2.0",
        "protocol_version": "2025-06-18"
      },
      "caller": {
        "key_id": "k_8f3a2c",
        "subject": null,
        "ip": "203.0.113.9",
        "user_agent": "claude-ai/1.2.0"
      },
      "attrs": {
        "tool": "render",
        "duration_ms": 3,
        "is_error": false,
        "input_bytes": 5000,
        "output_bytes": 12,
        "output_kinds": [
          "text"
        ],
        "cancelled": false,
        "args": {
          "_truncated": true,
          "_bytes": 5000
        }
      }
    },
    {
      "id": "01a0f756-dc61-76df-9ecd-2f6a379ebc2d",
      "ts": "2026-10-01T12:01:00.001Z",
      "type": "log",
      "session_id": "s_01J9X0K3E2",
      "client": {
        "name": "claude-ai",
        "version": "1.2.0",
        "protocol_version": "2025-06-18"
      },
      "caller": {
        "key_id": "k_8f3a2c",
        "subject": null,
        "ip": "203.0.113.9",
        "user_agent": "claude-ai/1.2.0"
      },
      "attrs": {
        "level": "debug",
        "message": "dump",
        "fields": {
          "_truncated": true,
          "_bytes": 70000
        }
      }
    },
    {
      "id": "01a0f756-dc62-76e0-aeec-2f6a379edb1c",
      "ts": "2026-10-01T12:01:00.002Z",
      "type": "custom",
      "session_id": "s_01J9X0K3E2",
      "client": {
        "name": "claude-ai",
        "version": "1.2.0",
        "protocol_version": "2025-06-18"
      },
      "caller": {
        "key_id": "k_8f3a2c",
        "subject": null,
        "ip": "203.0.113.9",
        "user_agent": "claude-ai/1.2.0"
      },
      "attrs": {
        "name": "big",
        "props": {
          "_truncated": true,
          "_bytes": 9000
        }
      }
    }
  ]
}
